{
  "id": "vivo-y19s",
  "name": "vivo Y19s",
  "brand": "vivo",
  "category": "smartphone",
  "series": "Y",
  "form": "bar",
  "status": "released",
  "announced": "2024-11-04",
  "prices": [
    {
      "region": "MY",
      "currency": "MYR",
      "amount": 499,
      "config": "6 GB / 128 GB",
      "date": "2024-11-04",
      "type": "launch",
      "source": "lowyat",
      "url": "https://www.lowyat.net/2024/336601/vivo-y19s-price/",
      "class": "news",
      "accessed": "2026-09-18"
    },
    {
      "region": "MY",
      "currency": "MYR",
      "amount": 599,
      "config": "8 GB / 256 GB",
      "date": "2024-11-04",
      "type": "launch",
      "source": "lowyat",
      "url": "https://www.lowyat.net/2024/336601/vivo-y19s-price/",
      "class": "news",
      "accessed": "2026-09-18"
    }
  ],
  "specs": {
    "display": {
      "size_in": 6.68,
      "type": "LCD",
      "resolution": "1608 × 720",
      "refresh_hz": 90,
      "peak_nits": 1000,
      "ppi": 264
    },
    "memory": {
      "ram_gb": [
        6,
        8
      ],
      "storage_gb": [
        128,
        256
      ],
      "ram_type": "LPDDR4X",
      "storage_type": "eMMC 5.1",
      "card": "1 TB"
    },
    "battery": {
      "capacity_mah": 5500,
      "chemistry": "Li-ion battery"
    },
    "charging": {
      "wired_w": 15,
      "claim": "15W"
    },
    "camera": {
      "front": "5 MP",
      "rear_detail": [
        "Photo, Night, Portrait, Video, Live Photo, Slo-mo, Time-lapse, Pro, Pano, Documents, 50 MP"
      ],
      "front_detail": [
        "5 MP, f/2.2"
      ]
    },
    "connectivity": {
      "cellular": "4G",
      "bands_2g": "850/900/1800 MHz",
      "bands_3g": "B1/B5/B8",
      "bands_4g": "4G FDD-LTE: B1/B3/B5/B7/B8/B20/B28",
      "technology": "GSM / HSPA / LTE",
      "sim": "2 nano SIMs + 1 microSD",
      "wifi": "2.4 GHz / 5 GHz",
      "bluetooth": "Bluetooth 5.2",
      "usb": "USB 2.0; USB Port; Type-C",
      "radio": "Yes",
      "nfc": false,
      "positioning": "GPS, BeiDou, GLONASS, Galileo, QZSS"
    },
    "build": {
      "dimensions": {
        "height_mm": 165.75,
        "width_mm": 76.1,
        "depth_mm": 8.1
      },
      "weight_g": 198.0,
      "ip": "IP64",
      "back": "Composite plastic sheet"
    },
    "software": {
      "launch_os": "Funtouch OS 14"
    },
    "platform": {
      "chipset": "unisoc-t612",
      "process": "12 nm",
      "cpu": "8 cores; 2 × 1.8 GHz + 6 × 1.8 GHz"
    },
    "misc": {
      "colors": "Black, Blue, Silver"
    },
    "biometrics": {
      "fingerprint": "Side-mounted capacitive fingerprint sensor"
    },
    "sensors": "Accelerometer, Ambient Light Sensor, Proximity Sensor, E-compass, Virtual Gyroscope, Motor"
  },
  "provenance": {
    "default": {
      "class": "official",
      "source": "vivo",
      "url": "https://www.vivo.com/my/products/param/y19s",
      "checked": "2026-09-18",
      "note": "Read from vivo Malaysia's specification page on 2026-09-18. Values were extracted automatically and reviewed; anything the page does not state is left out."
    },
    "fields": {
      "specs.platform": {
        "class": "news",
        "source": "lowyat",
        "url": "https://www.lowyat.net/2024/337011/vivo-y19s-malaysia/",
        "note": "Chip named in Lowyat.NET's Malaysian coverage; the maker's own specification data for this model does not name it.",
        "checked": "2026-09-18"
      },
      "announced": {
        "class": "news",
        "source": "lowyat",
        "url": "https://www.lowyat.net/2024/336601/vivo-y19s-price/",
        "checked": "2026-09-18",
        "note": "Date of the first Malaysian launch report found (Lowyat.NET). The global announcement can be earlier."
      },
      "specs.platform.cpu": {
        "class": "official",
        "source": "vivo",
        "url": "https://www.vivo.com/my/products/param/y19s",
        "checked": "2026-09-18",
        "note": "Read from vivo Malaysia's specification page on 2026-09-18. Values were extracted automatically and reviewed; anything the page does not state is left out."
      },
      "specs.platform.process": {
        "class": "official",
        "source": "vivo",
        "url": "https://www.vivo.com/my/products/param/y19s",
        "checked": "2026-09-18",
        "note": "Read from vivo Malaysia's specification page on 2026-09-18. Values were extracted automatically and reviewed; anything the page does not state is left out."
      },
      "specs.display.ppi": {
        "class": "platform",
        "source": "platform",
        "note": "Calculated from resolution and screen size."
      }
    }
  },
  "dataStatus": "compiled",
  "image": {
    "kind": "official",
    "src": "https://asia-exstatic-vivofs.vivo.com/PSee2l50xoirPK7y/1730778287951/f68a24f345fd68be6ec977c1f8ddda8a.png",
    "page": "https://www.vivo.com/my/products/param/y19s",
    "credit": "vivo Malaysia",
    "checked": "2026-09-19"
  }
}
