{
  "id": "oppo-reno13-pro",
  "name": "OPPO Reno13 Pro 5G",
  "brand": "oppo",
  "category": "smartphone",
  "series": "Reno",
  "form": "bar",
  "status": "released",
  "announced": "2025-01-07",
  "prices": [
    {
      "region": "MY",
      "currency": "MYR",
      "amount": 2999,
      "config": "12 GB / 512 GB",
      "date": "2025-01-07",
      "type": "launch",
      "source": "soyacincau",
      "url": "https://soyacincau.com/2025/01/07/oppo-reno-13-series-malaysia-launch-price/",
      "class": "news",
      "accessed": "2026-09-18"
    }
  ],
  "image": {
    "kind": "official",
    "src": "https://www.oppo.com/content/dam/oppo/common/mkt/v2-2/reno13-series/list-page/reno13-pro-5g/purple.png",
    "page": "https://www.oppo.com/my/smartphones/series-reno/reno13-pro/",
    "credit": "OPPO Malaysia",
    "checked": "2026-09-18"
  },
  "specs": {
    "display": {
      "size_in": 6.83,
      "type": "AMOLED",
      "resolution": "2800 × 1272",
      "refresh_hz": 120,
      "peak_nits": 1200,
      "protection": "Corning Gorilla Glass 7i",
      "ppi": 450
    },
    "platform": {
      "chipset": "dimensity-8350",
      "gpu": "ARM G615-MC6, 1303MHz",
      "cpu": "8 cores"
    },
    "memory": {
      "ram_gb": [
        12
      ],
      "storage_gb": [
        512
      ],
      "ram_type": "LPDDR5X@4266MHz 4 x 16 bits",
      "storage_type": "UFS 3.1"
    },
    "battery": {
      "capacity_mah": 5800
    },
    "camera": {
      "rear": [
        {
          "role": "main",
          "mp": 50,
          "aperture": "f/1.8",
          "ois": true
        },
        {
          "role": "ultrawide",
          "mp": 8
        },
        {
          "role": "telephoto",
          "mp": 50
        }
      ],
      "front": "50 MP",
      "rear_detail": [
        "Wide angle: 50 MP; f/1.8; FOV 84°; 6P lens; AF supported; OIS supported",
        "Ultra-wide angle: 8MP; f/2.2; FOV 116°; 5P lens; AF supported",
        "Telephoto: 50 MP; f/2.8; 1G3P lens; AF supported; OIS supported"
      ],
      "front_detail": [
        "50 MP, f/2.0, FOV 90°; 5P lens; AF supported"
      ],
      "video": "4K@60fps; 1080p",
      "front_video": "4K@60fps; 1080p"
    },
    "connectivity": {
      "cellular": "5G",
      "nfc": true,
      "bands_2g": "850/900/1800/1900MHz",
      "bands_3g": "Bands 1/2/4/5/6/8/19",
      "bands_4g": "4G LTE FDD: Bands 1/2/3/4/5/7/8/12/13/17/18/19/20/26/28/32/66; 4G LTE TDD: Bands 34/38/39/40/41",
      "bands_5g": "5G NR: n1/n2/n3/n5/n7/n8/n12/n20/n26/n28/n66/n38/n40/n41/n77/n78",
      "technology": "GSM / HSPA / LTE / 5G",
      "sim": "Nano-SIM card, Nano-USIM card + eSIM",
      "wifi": "WiFi 2.4G, WiFi 5G, WiFi 6E, WiFi 6 (802.11ax) , WiFi 5 (802.11ac); 802.11b/g/a/n, WLAN 2.4G, WLAN 5G, WLAN 5.1G, WLAN 5.4G, WLAN 5.8G, WLAN 6G; WLAN Display, WLAN tethering",
      "bluetooth": "Bluetooth 5.4, Low Energy",
      "usb": "Type-C",
      "positioning": "Single band: Beidou, GPS, GLONASS, Galileo, QZSS"
    },
    "build": {
      "dimensions": {
        "height_mm": 162.73,
        "width_mm": 76.55,
        "depth_mm": 7.55
      },
      "weight_g": 195.0
    },
    "software": {
      "launch_os": "ColorOS 15.0"
    },
    "charging": {
      "claim": "Protocols supported: SUPERVOOC 2.0, SUPERVOOC , VOOC 3.0, and PD2.0 (9V/1.5A)"
    },
    "biometrics": {
      "face": "Yes",
      "fingerprint": "In-display optical fingerprint sensor"
    },
    "sensors": "Proximity sensor, Ambient light sensor, Colour temperature sensor, E-compass, Accelerometer, Gyroscope, In-display optical fingerprint sensor, Infrared remote control",
    "audio": {
      "jack": false
    },
    "misc": {
      "colors": "Plume Purple, Graphite Grey"
    }
  },
  "provenance": {
    "default": {
      "class": "official",
      "source": "oppo",
      "url": "https://www.oppo.com/my/smartphones/series-reno/reno13-pro/specs/",
      "checked": "2026-09-18",
      "note": "Read from OPPO Malaysia's specification page on 2026-09-18. Values were extracted automatically and reviewed; anything the page does not state is left out."
    },
    "fields": {
      "announced": {
        "class": "news",
        "source": "soyacincau",
        "url": "https://soyacincau.com/2025/01/07/oppo-reno-13-series-malaysia-launch-price/",
        "checked": "2026-09-18",
        "note": "Date of the first Malaysian launch report found (SoyaCincau). The global announcement can be earlier."
      },
      "specs.display.ppi": {
        "class": "platform",
        "source": "platform",
        "note": "Calculated from resolution and screen size."
      }
    }
  },
  "dataStatus": "compiled"
}
