{
  "id": "redmi-a3",
  "name": "Redmi A3",
  "brand": "redmi",
  "category": "smartphone",
  "series": "Redmi A",
  "form": "bar",
  "status": "released",
  "announced": "2024-03-15",
  "prices": [
    {
      "region": "MY",
      "currency": "MYR",
      "amount": 429,
      "config": "4 GB / 128 GB",
      "date": "2024-03-15",
      "type": "launch",
      "source": "soyacincau",
      "url": "https://soyacincau.com/2024/03/15/xiaomi-redmi-a3-malaysia-pricing-specs-launch-official/",
      "class": "news",
      "accessed": "2026-09-18"
    }
  ],
  "image": {
    "kind": "official",
    "src": "https://i02.appmifile.com/954_item_my/02/04/2024/4d66f51dccce5274525ba5c129c90ca8.png",
    "page": "https://www.mi.com/my/product/redmi-a3/specs/",
    "credit": "Xiaomi Malaysia",
    "checked": "2026-09-18"
  },
  "specs": {
    "display": {
      "size_in": 6.71,
      "resolution": "1650 × 720",
      "refresh_hz": 90,
      "peak_nits": 500,
      "ppi": 268
    },
    "platform": {
      "chipset": "helio-g36",
      "cpu": "Up to 2.2GHz"
    },
    "memory": {
      "ram_gb": [
        3,
        4
      ],
      "storage_gb": [
        64,
        128
      ],
      "ram_type": "LPDDR4X"
    },
    "battery": {
      "capacity_mah": 5000
    },
    "charging": {
      "wired_w": 10,
      "claim": "Supports 10W charging"
    },
    "camera": {
      "rear": [
        {
          "role": "main",
          "mp": 8,
          "aperture": "f/2.0"
        }
      ],
      "rear_detail": [
        "filmCamera; HDR mode; , Portrait mode; Time-lapse, 8MP main camera, 4P lens, f/2.0, Auxiliary lens"
      ],
      "video": "1080p@30fps",
      "front_detail": [
        "filmCamera; HDR mode; Soft-light ring, Portrait mode; Time-lapse, 5MP front camera, f/2.2"
      ],
      "front_video": "1080p@30fps"
    },
    "connectivity": {
      "cellular": "4G",
      "bands_3g": "1/5/8",
      "bands_4g": "LTE TDD: 38/40/41; LTE FDD: 1/3/5/7/8/20/28",
      "technology": "HSPA / LTE",
      "wifi": "2.4GHz/5GHz Wi-Fi",
      "positioning": "GPS; Glonass; Galileo; Beidou",
      "sim": "Dual SIM + microSD, supports dual 4G",
      "bluetooth": "Bluetooth 5.4",
      "usb": "USB Type-C"
    },
    "build": {
      "dimensions": {
        "height_mm": 168.4,
        "width_mm": 76.3,
        "depth_mm": 8.3
      }
    },
    "software": {
      "launch_os": "Android 14"
    },
    "sensors": "Virtual proximity sensor, Virtual ambient light sensor, Accelerometer, Electronic compass",
    "audio": {
      "jack": true
    },
    "biometrics": {
      "fingerprint": "Side fingerprint sensor"
    },
    "misc": {
      "colors": "Midnight Black, Forest Green, Star Blue"
    }
  },
  "provenance": {
    "default": {
      "class": "official",
      "source": "redmi",
      "url": "https://www.mi.com/my/product/redmi-a3/specs/",
      "checked": "2026-09-18",
      "note": "Read from Xiaomi Malaysia's specification page on 2026-09-18. Values were extracted automatically and reviewed; anything the page does not state is left out."
    },
    "fields": {
      "announced": {
        "class": "news",
        "source": "soyacincau",
        "url": "https://soyacincau.com/2024/03/15/xiaomi-redmi-a3-malaysia-pricing-specs-launch-official/",
        "checked": "2026-09-18",
        "note": "Date of the first Malaysian launch report found (SoyaCincau). The global announcement can be earlier."
      },
      "specs.display.ppi": {
        "class": "platform",
        "source": "platform",
        "note": "Calculated from resolution and screen size."
      }
    }
  },
  "dataStatus": "compiled"
}
