{
  "id": "realme-c100x",
  "name": "realme C100x",
  "brand": "realme",
  "category": "smartphone",
  "series": "realme C",
  "form": "bar",
  "status": "released",
  "announced": "2026-08-28",
  "released": "2026-08-28",
  "segment": "entry",
  "aliases": [
    "C100x"
  ],
  "summary": "A 6.8-inch 120 Hz 5G budget phone with a 8,000 mAh battery, 45 W charging and a 50 MP main camera.",
  "highlights": [
    "6.8-inch 120 Hz",
    "8,000 mAh, 45 W"
  ],
  "prices": [
    {
      "region": "MY",
      "currency": "MYR",
      "amount": 999,
      "config": "Retail price",
      "date": "2026-09-02",
      "type": "launch",
      "source": "soyacincau",
      "url": "https://soyacincau.com/2026/09/02/realme-c100x-malaysia-8000mah-battery-launch-price-specs/",
      "class": "news",
      "accessed": "2026-09-25"
    }
  ],
  "specs": {
    "build": {
      "weight_g": 219.0,
      "dimensions": {
        "height_mm": 166.48,
        "width_mm": 78.23,
        "depth_mm": 8.78
      }
    },
    "memory": {
      "ram_gb": [
        6
      ],
      "storage_gb": [
        256
      ]
    },
    "display": {
      "size_in": 6.8,
      "resolution": "1570 × 720",
      "refresh_hz": 120,
      "ppi": 254,
      "peak_nits": 900,
      "type": "LCD"
    },
    "camera": {
      "rear": [
        {
          "role": "main",
          "mp": 50
        }
      ],
      "front": "5 MP"
    },
    "battery": {
      "capacity_mah": 8000
    },
    "charging": {
      "wired_w": 45
    },
    "software": {
      "launch_os": "Android 16"
    },
    "connectivity": {
      "cellular": "5G",
      "wifi": "Wi-Fi 5",
      "nfc": true
    }
  },
  "provenance": {
    "default": {
      "class": "official",
      "source": "realme",
      "url": "https://www.realme.com/my/realme-c100x/specs",
      "checked": "2026-09-25",
      "note": "Read automatically from the maker’s Malaysian specification page and reviewed; values not found on the page are left out."
    }
  },
  "dataStatus": "compiled"
}
